{
  "schema_version": 1,
  "packet_id": "sample-tsf-kernel-v2-hq-escalation",
  "created_at": "2026-07-08T00:00:00Z",
  "mission_summary": "Sample escalation packet for a TSF foreground mission lifecycle result. This is schema evidence only and does not call an API.",
  "preflight_result": {
    "verdict": "TIM_REQUIRED",
    "summary": "Exact approval missing."
  },
  "verifier_result": {
    "verdict": "",
    "summary": "Verifier not run because preflight did not approve the mission."
  },
  "blocker_register": [
    {
      "blocker_id": "approval-missing",
      "severity": "HIGH",
      "summary": "Mission requested a restricted action without a matching active approval ledger entry."
    }
  ],
  "changed_files_summary": [],
  "evidence_snippets": [
    {
      "label": "preflight",
      "source_path": "preflight_result.json",
      "summary": "Preflight returned TIM_REQUIRED."
    }
  ],
  "exact_decision_requested": "Decide whether this mission should stop for exact Tim approval or be repacketized.",
  "allowed_verdicts": [
    "GREEN",
    "YELLOW",
    "RED",
    "TIM_REQUIRED"
  ],
  "required_json_response_shape": {
    "verdict": "TIM_REQUIRED",
    "rationale": "Short explanation.",
    "required_tim_gate": "Exact approval language if needed.",
    "safe_next_action": "One bounded next step."
  }
}
